{
  "schema": "aether.project/v1",
  "name": "atlas_audit",
  "version": "0.1.0",
  "units": [
    {
      "path": "main.ae",
      "role": "main"
    }
  ],
  "lock": {
    "units": [
      {
        "path": "main.ae",
        "sha256": "e8fcd761fd813f1923e02c2694f8b259dd945025a7e3ebb79e84562c0b12b936"
      }
    ]
  }
}
