{
  "schema": "aether.project/v1",
  "name": "ledger_app_pkg",
  "version": "0.1.0",
  "units": [
    {
      "path": "main.ae",
      "role": "main"
    }
  ],
  "lock": {
    "units": [
      {
        "path": "main.ae",
        "sha256": "f4b527333c1c2210608bdd3612aa0c4f56bd12b1a5972d071a235e9a4f08d209"
      }
    ]
  }
}
